{"status":"fail","recommended_next_action":"repair","summary":"Persisted valuation refresh can replace the current published stash with an empty scan when the source scan rows are missing, so the task is not review-ready.","findings":[{"severity":"high","title":"Persisted valuation refresh publishes a blank scan if the source rows cannot be reloaded","details":"`run_persisted_valuation_refresh()` treats an empty reload of the current published scan as a successful refresh. If `account_stash_scan_tabs` and the V2/legacy item rows are gone, expired, or partially unavailable, it still writes a new published marker for the new scan ID. That silently replaces the last good published stash with an empty one, violating the product requirement to republish valuations from persisted stash rows while keeping the current published scan visible until a valid replacement exists. The change also lacks regression coverage for this empty-source path.","evidence":["poe_trade/ingestion/account_stash_harvester.py:1074-1080 loads `tabs` and `item_rows`, but there is no non-empty source validation before continuing to publication.","poe_trade/ingestion/account_stash_harvester.py:1327-1334 immediately proceeds to write V2 rows/history and finalize the refresh as `published`, even when the pending row lists are empty.","Repro with a ClickHouse stub returning empty strings for every query: `.venv/bin/python - <<'PY' ... run_persisted_valuation_refresh(...) ... PY` returned `{'scanId': 'scan-2', 'status': 'published', ...}` and recorded `published_marker_writes 1` despite there being no source tabs or items to republish.","tests/unit/test_account_stash_harvester.py:199-245 covers only the populated-source success case for persisted refresh; there is no test asserting failure/rollback when the published source scan cannot be reloaded."]}]}