{"status":"pass","recommended_next_action":"accept","summary":"No material task-scoped issues found. The live defect tracked in `FM-003` appears repaired, the previously missing selectors now exist in the tree, `acceptance-rerun.log` records all 54 acceptance-gate commands without failure markers, and spot reruns of the task-critical selectors (`TM-012`, `TM-024`, `TM-026`, `TM-027`, `TM-050`) passed in the current worktree.","findings":[]}