{"status":"fail","recommended_next_action":"repair","summary":"Two material issues remain: the published-scan cache fix still has a TOCTOU race, and the required red-gate proof for the repaired regressions is missing.","findings":[{"severity":"high","title":"Published-scan cache scoping is still bypassable if the published scan changes between lookup and cache check","details":"`start_stash_valuations_refresh()` still reads `published_scan_id` before entering `_STASH_VALUATION_START_LOCK`, then uses that stale value to decide whether a pending refresh is reusable. The status and result routes use the same fetch-then-lock pattern. Because publishing a new scan happens asynchronously outside this lock, a scan that becomes current in that window can still be treated as stale-old/current-old, which reintroduces the exact wrong-scan dedup/status/result behavior this repair batch was meant to close.","evidence":["poe_trade/api/app.py:491-529 fetches `published_scan_id` before `_STASH_VALUATION_START_LOCK` in `start_stash_valuations_refresh()`; the same pattern appears in `/_status` at 1594-1618 and `/_result` at 1653-1668.","poe_trade/ingestion/account_stash_harvester.py:1069-1075 updates the published marker from background work without coordinating with `_STASH_VALUATION_START_LOCK`.","Ad-hoc replay in this worktree reproduced the race: while holding `_STASH_VALUATION_START_LOCK`, `start_stash_valuations_refresh()` fetched `scan-old`; after switching the current scan to `scan-new` and releasing the lock, it still returned `{'publishedScanId': 'scan-old', 'deduplicated': True}`."]},{"severity":"medium","title":"The required red-gate evidence for the repaired regressions was never recorded","details":"This batch's plan explicitly requires proving the new cache-path regressions go red before the fix and rerunning the narrow regression gates. The recorded verification only shows repeated quality-phase passes. Given the task instructions say missing objective proof is failure, the run does not contain the evidence required to trust that the new tests actually exposed the bug before the implementation changed.","evidence":[".machine/runtime/ExecutionPlan.md:10-19 requires making the live cache path observably red; .machine/runtime/Runbook.md:4-14 requires running `.venv/bin/pytest tests/unit/test_api_stash_valuations.py` and `.venv/bin/pytest tests/unit/test_stash_scan.py` as the reproduce-first/red steps.",".machine/runtime/VerificationPlan.json:2-5 defines those two commands as `red_gate_commands`.",".machine/runtime/logs/verify.log shows only `Phase: quality` runs (for example lines 4-29) and no `Phase: red` or standalone execution of the red gates."]}]}